{
  "schema": "PTYSD_TASK_ENVELOPE_V1",
  "task_id": "B0-E2E-001",
  "project_id": "CHATGPT_GLOBAL_SKILL_GOVERNANCE",
  "owner_principal_id": "e2e-runner",
  "owner_session_id": "e2e-session",
  "provider_session_id": "e2e-provider-session",
  "interrupt_epoch": 0,
  "owner_generation": 5,
  "objective": "Validate missionctl persist-dispatch-complete lifecycle",
  "provider_write": false,
  "allowed_paths": ["sandbox/**"],
  "evidence_required": ["TEST_PASS"]
}
